{
  "title": "person",
  "supported_type": "ExtendedMetadata",
  "enabled": true,
  "attributes": [
    {
      "title": "first_name",
      "type": "String",
      "required": true
    },
    {
      "title": "last_name",
      "label": "last name",
      "description": null,
      "type": "String",
      "pid": "http://schema.org/family_name"
    }
  ]
}